[
  {
    "id": "mov-001",
    "title": "Interstellar",
    "type": "Movie",
    "release_year": 2014,
    "genres": ["Sci-Fi", "Drama", "Adventure"],
    "language": "English",
    "moods": ["Mind-bending", "Thought-provoking", "Emotional"],
    "tags": ["space", "time-travel", "wormhole", "black-hole", "survival", "future", "physics"],
    "duration_minutes": 169,
    "duration_display": "2h 49m",
    "rating": 8.7,
    "synopsis": "A team of explorers travels through a wormhole in space in an attempt to ensure humanity's survival as Earth faces ecological collapse.",
    "poster_gradient": "linear-gradient(135deg, #0f172a 0%, #1e1b4b 50%, #312e81 100%)",
    "featured_cast": ["Matthew McConaughey", "Anne Hathaway", "Jessica Chastain"]
  },
  {
    "id": "mov-002",
    "title": "Inception",
    "type": "Movie",
    "release_year": 2010,
    "genres": ["Sci-Fi", "Action", "Thriller"],
    "language": "English",
    "moods": ["Mind-bending", "Suspenseful", "Adrenaline-pumping"],
    "tags": ["dreams", "subconscious", "heist", "architecture", "reality", "psychological"],
    "duration_minutes": 148,
    "duration_display": "2h 28m",
    "rating": 8.8,
    "synopsis": "A skilled thief who steals corporate secrets through dream-sharing technology is given the inverse task of planting an idea into a CEO's mind.",
    "poster_gradient": "linear-gradient(135deg, #18181b 0%, #27272a 50%, #3f3f46 100%)",
    "featured_cast": ["Leonardo DiCaprio", "Joseph Gordon-Levitt", "Elliot Page"]
  },
  {
    "id": "mov-003",
    "title": "Blade Runner 2049",
    "type": "Movie",
    "release_year": 2017,
    "genres": ["Sci-Fi", "Mystery", "Drama"],
    "language": "English",
    "moods": ["Dark", "Thought-provoking", "Atmospheric"],
    "tags": ["cyberpunk", "artificial-intelligence", "dystopian", "detective", "memory", "future"],
    "duration_minutes": 164,
    "duration_display": "2h 44m",
    "rating": 8.0,
    "synopsis": "A young blade runner's discovery of a long-buried secret leads him to track down former blade runner Rick Deckard, who's been missing for thirty years.",
    "poster_gradient": "linear-gradient(135deg, #451a03 0%, #78350f 50%, #9a3412 100%)",
    "featured_cast": ["Ryan Gosling", "Harrison Ford", "Ana de Armas"]
  },
  {
    "id": "mov-004",
    "title": "Ex Machina",
    "type": "Movie",
    "release_year": 2014,
    "genres": ["Sci-Fi", "Drama", "Mystery"],
    "language": "English",
    "moods": ["Dark", "Thought-provoking", "Suspenseful"],
    "tags": ["artificial-intelligence", "turing-test", "robotics", "psychological-thriller", "isolated"],
    "duration_minutes": 108,
    "duration_display": "1h 48m",
    "rating": 7.7,
    "synopsis": "A programmer is invited by his company's reclusive CEO to administer a Turing test to an intelligent humanoid robot named Ava.",
    "poster_gradient": "linear-gradient(135deg, #022c22 0%, #064e3b 50%, #047857 100%)",
    "featured_cast": ["Alicia Vikander", "Domhnall Gleeson", "Oscar Isaac"]
  },
  {
    "id": "mov-005",
    "title": "Parasite",
    "type": "Movie",
    "release_year": 2019,
    "genres": ["Drama", "Thriller", "Comedy"],
    "language": "Korean",
    "moods": ["Dark", "Suspenseful", "Thought-provoking"],
    "tags": ["class-divide", "social-commentary", "con-artists", "satire", "family"],
    "duration_minutes": 132,
    "duration_display": "2h 12m",
    "rating": 8.5,
    "synopsis": "Greed and class discrimination threaten the newly formed symbiotic relationship between the wealthy Park family and the destitute Kim clan.",
    "poster_gradient": "linear-gradient(135deg, #1c1917 0%, #292524 50%, #44403c 100%)",
    "featured_cast": ["Song Kang-ho", "Lee Sun-kyun", "Cho Yeo-jeong"]
  },
  {
    "id": "mov-006",
    "title": "Spirited Away",
    "type": "Movie",
    "release_year": 2001,
    "genres": ["Animation", "Adventure", "Fantasy"],
    "language": "Japanese",
    "moods": ["Heartwarming", "Feel-Good", "Inspiring"],
    "tags": ["spirits", "magic", "coming-of-age", "folklore", "supernatural", "journey"],
    "duration_minutes": 125,
    "duration_display": "2h 05m",
    "rating": 8.6,
    "synopsis": "During her family's move to the suburbs, a sullen 10-year-old girl wanders into a world ruled by gods, witches, and spirits, where humans are changed into beasts.",
    "poster_gradient": "linear-gradient(135deg, #064e3b 0%, #0f766e 50%, #14b8a6 100%)",
    "featured_cast": ["Rumi Hiiragi", "Miyu Irino", "Mari Natsuki"]
  },
  {
    "id": "mov-007",
    "title": "3 Idiots",
    "type": "Movie",
    "release_year": 2009,
    "genres": ["Comedy", "Drama"],
    "language": "Hindi",
    "moods": ["Feel-Good", "Inspiring", "Heartwarming"],
    "tags": ["college", "engineering", "friendship", "education-system", "life-lessons"],
    "duration_minutes": 170,
    "duration_display": "2h 50m",
    "rating": 8.4,
    "synopsis": "Two friends embark on a quest for a lost college buddy while reliving their student days and the rebellious philosophy that changed their lives.",
    "poster_gradient": "linear-gradient(135deg, #78350f 0%, #b45309 50%, #f59e0b 100%)",
    "featured_cast": ["Aamir Khan", "Madhavan", "Sharman Joshi", "Kareena Kapoor"]
  },
  {
    "id": "mov-008",
    "title": "Andhadhun",
    "type": "Movie",
    "release_year": 2018,
    "genres": ["Crime", "Thriller", "Mystery"],
    "language": "Hindi",
    "moods": ["Dark", "Suspenseful", "Mind-bending"],
    "tags": ["piano", "fake-blindness", "murder", "twists", "black-comedy"],
    "duration_minutes": 139,
    "duration_display": "2h 19m",
    "rating": 8.2,
    "synopsis": "A piano player pretending to be visually impaired unwittingly becomes entangled in a web of murder, deceit, and black-market organ trades.",
    "poster_gradient": "linear-gradient(135deg, #450a0a 0%, #7f1d1d 50%, #991b1b 100%)",
    "featured_cast": ["Ayushmann Khurrana", "Tabu", "Radhika Apte"]
  },
  {
    "id": "mov-009",
    "title": "Knives Out",
    "type": "Movie",
    "release_year": 2019,
    "genres": ["Comedy", "Crime", "Mystery"],
    "language": "English",
    "moods": ["Feel-Good", "Suspenseful", "Chill"],
    "tags": ["whodunit", "detective", "inheritance", "eccentric-family", "investigation"],
    "duration_minutes": 130,
    "duration_display": "2h 10m",
    "rating": 7.9,
    "synopsis": "A detective investigates the death of a patriarch of an eccentric, combative family after an 85th birthday celebration goes deadly wrong.",
    "poster_gradient": "linear-gradient(135deg, #365314 0%, #4d7c0f 50%, #65a30d 100%)",
    "featured_cast": ["Daniel Craig", "Ana de Armas", "Chris Evans"]
  },
  {
    "id": "mov-010",
    "title": "The Grand Budapest Hotel",
    "type": "Movie",
    "release_year": 2014,
    "genres": ["Comedy", "Adventure", "Crime"],
    "language": "English",
    "moods": ["Feel-Good", "Chill", "Heartwarming"],
    "tags": ["concierge", "heist", "painting", "aesthetic", "quirky", "friendship"],
    "duration_minutes": 99,
    "duration_display": "1h 39m",
    "rating": 8.1,
    "synopsis": "A writer encounters the owner of an aging high-class hotel, who tells him of his early years serving as a lobby boy to an exceptional concierge.",
    "poster_gradient": "linear-gradient(135deg, #831843 0%, #be185d 50%, #db2777 100%)",
    "featured_cast": ["Ralph Fiennes", "Tony Revolori", "Saoirse Ronan"]
  },
  {
    "id": "mov-011",
    "title": "A Quiet Place",
    "type": "Movie",
    "release_year": 2018,
    "genres": ["Horror", "Sci-Fi", "Drama"],
    "language": "English",
    "moods": ["Dark", "Suspenseful", "Adrenaline-pumping"],
    "tags": ["monsters", "sound-hunting", "family", "post-apocalyptic", "survival"],
    "duration_minutes": 90,
    "duration_display": "1h 30m",
    "rating": 7.5,
    "synopsis": "A family struggles for survival in a world where most humans have been killed by blind but noise-sensitive creatures.",
    "poster_gradient": "linear-gradient(135deg, #1e1b4b 0%, #311042 50%, #4c0519 100%)",
    "featured_cast": ["Emily Blunt", "John Krasinski", "Millicent Simmonds"]
  },
  {
    "id": "mov-012",
    "title": "Arrival",
    "type": "Movie",
    "release_year": 2016,
    "genres": ["Sci-Fi", "Drama", "Mystery"],
    "language": "English",
    "moods": ["Mind-bending", "Thought-provoking", "Emotional"],
    "tags": ["aliens", "linguistics", "non-linear-time", "communication", "first-contact"],
    "duration_minutes": 116,
    "duration_display": "1h 56m",
    "rating": 7.9,
    "synopsis": "A linguist works with the military to communicate with alien lifeforms after twelve mysterious spacecraft appear across the world.",
    "poster_gradient": "linear-gradient(135deg, #0f172a 0%, #1e293b 50%, #334155 100%)",
    "featured_cast": ["Amy Adams", "Jeremy Renner", "Forest Whitaker"]
  },
  {
    "id": "mov-013",
    "title": "Coherence",
    "type": "Movie",
    "release_year": 2013,
    "genres": ["Sci-Fi", "Mystery", "Thriller"],
    "language": "English",
    "moods": ["Dark", "Mind-bending", "Suspenseful"],
    "tags": ["multiverse", "parallel-realities", "dinner-party", "comet", "quantum-physics"],
    "duration_minutes": 89,
    "duration_display": "1h 29m",
    "rating": 7.2,
    "synopsis": "Strange things begin to happen when a group of eight friends gather for a dinner party on the night an astronomical anomaly passes overhead.",
    "poster_gradient": "linear-gradient(135deg, #172554 0%, #1e3a8a 50%, #1d4ed8 100%)",
    "featured_cast": ["Emily Baldoni", "Maury Sterling", "Nicholas Brendon"]
  },
  {
    "id": "mov-014",
    "title": "Before Sunrise",
    "type": "Movie",
    "release_year": 1995,
    "genres": ["Romance", "Drama"],
    "language": "English",
    "moods": ["Chill", "Heartwarming", "Thought-provoking"],
    "tags": ["dialogue-driven", "vienna", "connection", "walking", "philosophy", "intimate"],
    "duration_minutes": 101,
    "duration_display": "1h 41m",
    "rating": 8.1,